{
  "adapter_version": "plc_read_only_runtime_adapter_v1",
  "read_only": true,
  "authority": "read_only_no_order_authority",
  "source_snapshot_id": "snapshot-sq02-local-001",
  "snapshot_feature_timestamp_ms": 1000,
  "runtime_clock_ms": 2000,
  "strategy_contract_id": "SQ02_DOWNSIDE_CONT_V0",
  "strategy_contract_status": "frozen",
  "trade_intent": {
    "decision": "allow",
    "strategy_contract_id": "SQ02_DOWNSIDE_CONT_V0",
    "campaign_id": "read-only-runtime-preview",
    "session_id": "readonly-snapshot-sq02-local-001",
    "direction": "SHORT",
    "action": "enter",
    "trigger_reason": "setup_present",
    "invalidation_reason": null,
    "evidence_text": "read_only_runtime_preview_contract_conditions_satisfied",
    "no_exchange_side_effect": true
  },
  "rejection_reasons": [],
  "no_exchange_side_effect": true
}
